{
    "$schema": "https://json-schema.org/draft/2020-12/schema",
    "$id": "https://vespucci.st.com/svc/schemas/v1alpha1/dataset-meta.schema.json",
    "title": "VespucciInertialCsvDataset",
    "description": "VespucciInertialCsv dataset schema spec",
    "type": "object",
    "required": [
        "name",
        "id"
    ],
    "properties": {
        "name": {
            "type": "string",
            "description": "Human-readable dataset name. No uniqueness requirement"
        },
        "description": {
            "type": "string",
            "description": "Dataset description"
        },
        "id": {
           "type": "string",
           "description": "Unique ID for the dataset" 
        },
        "classes": {
            "type": "array",
            "description": "The full set of ground truth labels used in the dataset",
            "items": {
                "type": "string"
            },
            "uniqueItems": true
        },
        "metadata": {
            "type": "object",
            "description": "Additional opaque unstructured data that may be attached to the dataset",
            "additionalProperties": true
        },
        "data": {
            "type": "array",
            "description": "Array of data items. A sequence of chunks/acquisitions",
            "items": { "$ref": "#/$defs/DataItem" }
        }
    },
    "$defs": {
        "DataItem": {
            "type": "object",
            "description": "Item in the `data` array. Logically equivalent to a `chunk` in the data-api model and roughly equivalent to an *acquisition* (rather, a portion of it that ) in the context of HSDatalog raw logs",
            "properties": {
                "start_time": {
                    "type": "string",
                    "description": "Start timestamp for the data in this item. An ISO8601 millisecond timestamp",
                    "format": "date-time"
                },
                "end_time": {
                    "type": "string",
                    "description": "End timestamp for the data in this item. An ISO 8601 millisecond timestamp",
                    "format": "date-time"
                },
                "class": {
                    "type": "string",
                    "description": "Ground truth label for "
                }
            }
        }
    }

}